data/processed/MA000018.csv

PartHeading,L1,L2,L3
Part 1— Application and Operation,1,,
Part 1— Application and Operation,2,2.1,
Part 1— Application and Operation,2,2.2,
Part 1— Application and Operation,2,2.3,
Part 1— Application and Operation,2,2.4,
Part 1— Application and Operation,2,2.5,
Part 1— Application and Operation,2,2.6,a
Part 1— Application and Operation,2,2.6,b
Part 1— Application and Operation,2,2.6,c
Part 1— Application and Operation,2,2.6,d
Part 1— Application and Operation,3,3.1,a
Part 1— Application and Operation,3,3.1,b
Part 1— Application and Operation,3,3.2,
Part 1— Application and Operation,4,4.1,
Part 1— Application and Operation,4,4.2,
Part 1— Application and Operation,4,4.3,
Part 1— Application and Operation,4,4.4,
Part 1— Application and Operation,4,4.5,
Part 1— Application and Operation,4,4.6,
Part 1— Application and Operation,4,4.7,
Part 1— Application and Operation,5,,
Part 1— Application and Operation,6,,
Part 1— Application and Operation,7,7.1,a
Part 1— Application and Operation,7,7.1,b
Part 1— Application and Operation,7,7.1,c
Part 1— Application and Operation,7,7.1,d
Part 1— Application and Operation,7,7.1,e
Part 1— Application and Operation,7,7.2,
Part 1— Application and Operation,7,7.3,
Part 1— Application and Operation,7,7.4,a
Part 1— Application and Operation,7,7.4,b
Part 1— Application and Operation,7,7.5,
Part 1— Application and Operation,7,7.6,a
Part 1— Application and Operation,7,7.6,b
Part 1— Application and Operation,7,7.6,c
Part 1— Application and Operation,7,7.6,d
Part 1— Application and Operation,7,7.6,e
Part 1— Application and Operation,7,7.7,a
Part 1— Application and Operation,7,7.7,b
Part 1— Application and Operation,7,7.8,
Part 1— Application and Operation,7,7.9,
Part 1— Application and Operation,7,7.10,
Part 1— Application and Operation,7,7.11,a
Part 1— Application and Operation,7,7.11,b
Part 1— Application and Operation,7,7.12,
Part 1— Application and Operation,7,7.13,
"Part 2— Workplace Delegates, Consultation and Dispute Resolution",7A,7A,
"Part 2— Workplace Delegates, Consultation and Dispute Resolution",7A,7A [2],a
"Part 2— Workplace Delegates, Consultation and Dispute Resolution",7A,7A [2],b
"Part 2— Workplace Delegates, Consultation and Dispute Resolution",7A,7A [2],c
"Part 2— Workplace Delegates, Consultation and Dispute Resolution",7A,7A [3],
"Part 2— Workplace Delegates, Consultation and Dispute Resolution",7A,7A [4],
"Part 2— Workplace Delegates, Consultation and Dispute Resolution",7A,7A [5],a
"Part 2— Workplace Delegates, Consultation and Dispute Resolution",7A,7A [5],b
"Part 2— Workplace Delegates, Consultation and Dispute Resolution",7A,7A [5],c
"Part 2— Workplace Delegates, Consultation and Dispute Resolution",7A,7A [5],d
"Part 2— Workplace Delegates, Consultation and Dispute Resolution",7A,7A [5],e
"Part 2— Workplace Delegates, Consultation and Dispute Resolution",7A,7A [5],f
"Part 2— Workplace Delegates, Consultation and Dispute Resolution",7A,7A [6],a
"Part 2— Workplace Delegates, Consultation and Dispute Resolution",7A,7A [6],b
"Part 2— Workplace Delegates, Consultation and Dispute Resolution",7A,7A [6],a [2]
"Part 2— Workplace Delegates, Consultation and Dispute Resolution",7A,7A [6],b [2]
"Part 2— Workplace Delegates, Consultation and Dispute Resolution",7A,7A [7],a
"Part 2— Workplace Delegates, Consultation and Dispute Resolution",7A,7A [7],b
"Part 2— Workplace Delegates, Consultation and Dispute Resolution",7A,7A [7],c
"Part 2— Workplace Delegates, Consultation and Dispute Resolution",7A,7A [7],d
"Part 2— Workplace Delegates, Consultation and Dispute Resolution",7A,7A [7],e
"Part 2— Workplace Delegates, Consultation and Dispute Resolution",7A,7A [7],f
"Part 2— Workplace Delegates, Consultation and Dispute Resolution",7A,7A [7],g
"Part 2— Workplace Delegates, Consultation and Dispute Resolution",7A,7A [8],a
"Part 2— Workplace Delegates, Consultation and Dispute Resolution",7A,7A [8],b
"Part 2— Workplace Delegates, Consultation and Dispute Resolution",7A,7A [8],c
"Part 2— Workplace Delegates, Consultation and Dispute Resolution",7A,7A [8],d
"Part 2— Workplace Delegates, Consultation and Dispute Resolution",8,8.1,a
"Part 2— Workplace Delegates, Consultation and Dispute Resolution",8,8.1,b
"Part 2— Workplace Delegates, Consultation and Dispute Resolution",8,8.1,c
"Part 2— Workplace Delegates, Consultation and Dispute Resolution",8,8.2,a
"Part 2— Workplace Delegates, Consultation and Dispute Resolution",8,8.2,b
"Part 2— Workplace Delegates, Consultation and Dispute Resolution",8,8.2,c
"Part 2— Workplace Delegates, Consultation and Dispute Resolution",8,8.3,
"Part 2— Workplace Delegates, Consultation and Dispute Resolution",8,8.4,
"Part 2— Workplace Delegates, Consultation and Dispute Resolution",8,8.5,a
"Part 2— Workplace Delegates, Consultation and Dispute Resolution",8,8.5,b
"Part 2— Workplace Delegates, Consultation and Dispute Resolution",8,8.5,c
"Part 2— Workplace Delegates, Consultation and Dispute Resolution",8,8.5,d
"Part 2— Workplace Delegates, Consultation and Dispute Resolution",8,8.5,e
"Part 2— Workplace Delegates, Consultation and Dispute Resolution",8,8.5,f
"Part 2— Workplace Delegates, Consultation and Dispute Resolution",8,8.5,g
"Part 2— Workplace Delegates, Consultation and Dispute Resolution",8,8.6,
"Part 2— Workplace Delegates, Consultation and Dispute Resolution",8A,8A,
"Part 2— Workplace Delegates, Consultation and Dispute Resolution",8A,8A [2],
"Part 2— Workplace Delegates, Consultation and Dispute Resolution",8A,8A [3],a
"Part 2— Workplace Delegates, Consultation and Dispute Resolution",8A,8A [3],b
"Part 2— Workplace Delegates, Consultation and Dispute Resolution",8A,8A [4],
"Part 2— Workplace Delegates, Consultation and Dispute Resolution",8A,8A [5],
"Part 2— Workplace Delegates, Consultation and Dispute Resolution",9,9.1,
"Part 2— Workplace Delegates, Consultation and Dispute Resolution",9,9.2,
"Part 2— Workplace Delegates, Consultation and Dispute Resolution",9,9.3,
"Part 2— Workplace Delegates, Consultation and Dispute Resolution",9,9.4,
"Part 2— Workplace Delegates, Consultation and Dispute Resolution",9,9.5,
"Part 2— Workplace Delegates, Consultation and Dispute Resolution",9,9.6,
"Part 2— Workplace Delegates, Consultation and Dispute Resolution",9,9.7,
"Part 2— Workplace Delegates, Consultation and Dispute Resolution",9,9.8,a
"Part 2— Workplace Delegates, Consultation and Dispute Resolution",9,9.8,b
"Part 2— Workplace Delegates, Consultation and Dispute Resolution",9,9.9,
Part 3— Types of Employment and Termination of Employment,10,10.1,a
Part 3— Types of Employment and Termination of Employment,10,10.1,b
Part 3— Types of Employment and Termination of Employment,10,10.1,c
Part 3— Types of Employment and Termination of Employment,10,10.2,
Part 3— Types of Employment and Termination of Employment,10,10.3,a
Part 3— Types of Employment and Termination of Employment,10,10.3,b
Part 3— Types of Employment and Termination of Employment,10,10.3,c
Part 3— Types of Employment and Termination of Employment,10,10.3,d
Part 3— Types of Employment and Termination of Employment,10,10.3,e
Part 3— Types of Employment and Termination of Employment,10,10.4,a
Part 3— Types of Employment and Termination of Employment,10,10.4,b
Part 3— Types of Employment and Termination of Employment,10,10.4,c
Part 3— Types of Employment and Termination of Employment,10,10.5,
Part 3— Types of Employment and Termination of Employment,11,11.1,a
Part 3— Types of Employment and Termination of Employment,11,11.1,b
Part 3— Types of Employment and Termination of Employment,11,11.1,c
Part 3— Types of Employment and Termination of Employment,11,11.1,d
Part 3— Types of Employment and Termination of Employment,11,11.1,e
Part 3— Types of Employment and Termination of Employment,11,11.1,f
Part 3— Types of Employment and Termination of Employment,11,11.2,
Part 3— Types of Employment and Termination of Employment,11,11.3,
Part 3— Types of Employment and Termination of Employment,12,12.1,a
Part 3— Types of Employment and Termination of Employment,12,12.1,b
Part 3— Types of Employment and Termination of Employment,12,12.1,c
Part 3— Types of Employment and Termination of Employment,12,12.2,a
Part 3— Types of Employment and Termination of Employment,12,12.2,b
Part 3— Types of Employment and Termination of Employment,12,12.2,c
Part 3— Types of Employment and Termination of Employment,12,12.3,a
Part 3— Types of Employment and Termination of Employment,12,12.3,b
Part 3— Types of Employment and Termination of Employment,12,12.3,c
Part 3— Types of Employment and Termination of Employment,12,12.3,d
Part 3— Types of Employment and Termination of Employment,12,12.3,e
Part 4— Minimum Wages and Related Matters,13,,
Part 4— Minimum Wages and Related Matters,14,14.1,
Part 4— Minimum Wages and Related Matters,14,14.2,
Part 4— Minimum Wages and Related Matters,14,14.3,
Part 4— Minimum Wages and Related Matters,14,14.4,
Part 4— Minimum Wages and Related Matters,14,14.5,a
Part 4— Minimum Wages and Related Matters,14,14.5,b
Part 4— Minimum Wages and Related Matters,14,14.6,a
Part 4— Minimum Wages and Related Matters,14,14.6,b
Part 4— Minimum Wages and Related Matters,14,14.6,c
Part 4— Minimum Wages and Related Matters,14,14.7,a
Part 4— Minimum Wages and Related Matters,14,14.7,b
Part 4— Minimum Wages and Related Matters,14,14.7,c
Part 4— Minimum Wages and Related Matters,14,14.7,d
Part 4— Minimum Wages and Related Matters,14,14.7,e
Part 4— Minimum Wages and Related Matters,14,14.7,f
Part 4— Minimum Wages and Related Matters,14,14.7,g
Part 4— Minimum Wages and Related Matters,14,14.7,h
Part 4— Minimum Wages and Related Matters,14,14.7,i
Part 4— Minimum Wages and Related Matters,15,15.1,a
Part 4— Minimum Wages and Related Matters,15,15.1,b
Part 4— Minimum Wages and Related Matters,15,15.2,a
Part 4— Minimum Wages and Related Matters,15,15.2,b
Part 4— Minimum Wages and Related Matters,15,15.2,c
Part 4— Minimum Wages and Related Matters,15,15.2,d
Part 4— Minimum Wages and Related Matters,15,15.3,a
Part 4— Minimum Wages and Related Matters,15,15.3,b
Part 4— Minimum Wages and Related Matters,15,15.3,c
Part 4— Minimum Wages and Related Matters,15,15.3,d
Part 4— Minimum Wages and Related Matters,15,15.4,a
Part 4— Minimum Wages and Related Matters,15,15.4,b
Part 4— Minimum Wages and Related Matters,15,15.4,c
Part 4— Minimum Wages and Related Matters,15,15.5,a
Part 4— Minimum Wages and Related Matters,15,15.5,b
Part 4— Minimum Wages and Related Matters,15,15.6,
Part 4— Minimum Wages and Related Matters,15,15.7,a
Part 4— Minimum Wages and Related Matters,15,15.7,b
Part 4— Minimum Wages and Related Matters,15,15.7,c
Part 4— Minimum Wages and Related Matters,16,,
Part 4— Minimum Wages and Related Matters,17,17.1,
Part 4— Minimum Wages and Related Matters,17,17.2,
Part 4— Minimum Wages and Related Matters,17,17.3,a
Part 4— Minimum Wages and Related Matters,17,17.3,b
Part 4— Minimum Wages and Related Matters,17,17.3,c
Part 4— Minimum Wages and Related Matters,17,17.4,
Part 4— Minimum Wages and Related Matters,18,,
Part 4— Minimum Wages and Related Matters,19,,
Part 4— Minimum Wages and Related Matters,20,20.1,
Part 4— Minimum Wages and Related Matters,20,20.2,
Part 4— Minimum Wages and Related Matters,21,21.1,a
Part 4— Minimum Wages and Related Matters,21,21.1,b
Part 4— Minimum Wages and Related Matters,21,21.2,
Part 4— Minimum Wages and Related Matters,21,21.3,a
Part 4— Minimum Wages and Related Matters,21,21.3,b
Part 4— Minimum Wages and Related Matters,21,21.3,c
Part 4— Minimum Wages and Related Matters,21,21.4,a
Part 4— Minimum Wages and Related Matters,21,21.4,b
Part 4— Minimum Wages and Related Matters,21,21.4,c
Part 4— Minimum Wages and Related Matters,21,21.4,d
Part 4— Minimum Wages and Related Matters,21,21.4,e
Part 4— Minimum Wages and Related Matters,21,21.4,f
Part 4— Minimum Wages and Related Matters,21,21.4,g
Part 4— Minimum Wages and Related Matters,21,21.4,h
Part 4— Minimum Wages and Related Matters,21,21.4,i
Part 4— Minimum Wages and Related Matters,21,21.4,j
Part 5— Hours of Work and Related Matters,22,22.1,a
Part 5— Hours of Work and Related Matters,22,22.1,b
Part 5— Hours of Work and Related Matters,22,22.1,c
Part 5— Hours of Work and Related Matters,22,22.2,a
Part 5— Hours of Work and Related Matters,22,22.2,b
Part 5— Hours of Work and Related Matters,22,22.3,
Part 5— Hours of Work and Related Matters,22,22.4,a
Part 5— Hours of Work and Related Matters,22,22.4,b
Part 5— Hours of Work and Related Matters,22,22.5,a
Part 5— Hours of Work and Related Matters,22,22.5,b
Part 5— Hours of Work and Related Matters,22,22.5,c
Part 5— Hours of Work and Related Matters,22,22.5,d
Part 5— Hours of Work and Related Matters,22,22.6,a
Part 5— Hours of Work and Related Matters,22,22.6,b
Part 5— Hours of Work and Related Matters,22,22.6,c
Part 5— Hours of Work and Related Matters,22,22.6,d
Part 5— Hours of Work and Related Matters,22,22.6,e
Part 5— Hours of Work and Related Matters,22,22.6,f
Part 5— Hours of Work and Related Matters,22,22.6,g
Part 5— Hours of Work and Related Matters,22,22.7,a
Part 5— Hours of Work and Related Matters,22,22.7,b
Part 5— Hours of Work and Related Matters,22,22.7,c
Part 5— Hours of Work and Related Matters,22,22.8,a
Part 5— Hours of Work and Related Matters,22,22.8,b
Part 5— Hours of Work and Related Matters,22,22.8,c
Part 5— Hours of Work and Related Matters,22,22.8,d
Part 5— Hours of Work and Related Matters,22,22.8,e
Part 5— Hours of Work and Related Matters,22,22.8,f
Part 5— Hours of Work and Related Matters,22,22.9,a
Part 5— Hours of Work and Related Matters,22,22.9,b
Part 5— Hours of Work and Related Matters,22,22.9,c
Part 5— Hours of Work and Related Matters,22,22.9,d
Part 5— Hours of Work and Related Matters,22,22.9,e
Part 5— Hours of Work and Related Matters,22,22.9,f
Part 5— Hours of Work and Related Matters,22,22.9,g
Part 5— Hours of Work and Related Matters,22,22.9,h
Part 5— Hours of Work and Related Matters,22,22.9,i
Part 5— Hours of Work and Related Matters,22,22.9,j
Part 5— Hours of Work and Related Matters,22,22.9,k
Part 5— Hours of Work and Related Matters,22,22.9,Nothing in this clause will preclude the employer from rostering an employee to work shiftwork instead of undertaking sleepovers.
Part 5— Hours of Work and Related Matters,22A,22A,
Part 5— Hours of Work and Related Matters,22A,22A [2],a
Part 5— Hours of Work and Related Matters,22A,22A [2],b
Part 5— Hours of Work and Related Matters,22A,22A [3],
Part 5— Hours of Work and Related Matters,22A,22A [4],a
Part 5— Hours of Work and Related Matters,22A,22A [4],b
Part 5— Hours of Work and Related Matters,23,23.1,
Part 5— Hours of Work and Related Matters,23,23.2,a
Part 5— Hours of Work and Related Matters,23,23.2,b
Part 5— Hours of Work and Related Matters,23,23.3,
Part 5— Hours of Work and Related Matters,24,24.1,a
Part 5— Hours of Work and Related Matters,24,24.1,b
Part 5— Hours of Work and Related Matters,24,24.2,a
Part 5— Hours of Work and Related Matters,24,24.2,b
Part 5— Hours of Work and Related Matters,24,24.2,c
Part 5— Hours of Work and Related Matters,24,24.2,d
Part 5— Hours of Work and Related Matters,25,25.1,a
Part 5— Hours of Work and Related Matters,25,25.1,b
Part 5— Hours of Work and Related Matters,25,25.1,c
Part 5— Hours of Work and Related Matters,25,25.1,d
Part 5— Hours of Work and Related Matters,25,25.1,e
Part 5— Hours of Work and Related Matters,25,25.1,f
Part 5— Hours of Work and Related Matters,25,25.2,a
Part 5— Hours of Work and Related Matters,25,25.2,b
Part 5— Hours of Work and Related Matters,25,25.2,c
Part 5— Hours of Work and Related Matters,25,25.2,d
Part 5— Hours of Work and Related Matters,25,25.2,e
Part 5— Hours of Work and Related Matters,25,25.2,f
Part 5— Hours of Work and Related Matters,25,25.2,g
Part 5— Hours of Work and Related Matters,25,25.2,h
Part 5— Hours of Work and Related Matters,25,25.2,i
Part 5— Hours of Work and Related Matters,25,25.2,j
Part 5— Hours of Work and Related Matters,25,25.2,k
Part 5— Hours of Work and Related Matters,26,26.1,a
Part 5— Hours of Work and Related Matters,26,26.1,b
Part 5— Hours of Work and Related Matters,26,26.1,c
Part 5— Hours of Work and Related Matters,26,26.1,d
Part 5— Hours of Work and Related Matters,26,26.2,
Part 5— Hours of Work and Related Matters,26,26.3,
Part 5— Hours of Work and Related Matters,27,27.1,a
Part 5— Hours of Work and Related Matters,27,27.1,b
Part 5— Hours of Work and Related Matters,27A,,
Part 6— Leave and Public Holidays,28,28.1,
Part 6— Leave and Public Holidays,28,28.2,a
Part 6— Leave and Public Holidays,28,28.2,b
Part 6— Leave and Public Holidays,28,28.2,c
Part 6— Leave and Public Holidays,28,28.3,a
Part 6— Leave and Public Holidays,28,28.3,b
Part 6— Leave and Public Holidays,28,28.4,a
Part 6— Leave and Public Holidays,28,28.4,b
Part 6— Leave and Public Holidays,28,28.5,a
Part 6— Leave and Public Holidays,28,28.5,b
Part 6— Leave and Public Holidays,28,28.5,c
Part 6— Leave and Public Holidays,28,28.5,d
Part 6— Leave and Public Holidays,28,28.6,a
Part 6— Leave and Public Holidays,28,28.6,b
Part 6— Leave and Public Holidays,28,28.6,c
Part 6— Leave and Public Holidays,28,28.6,d
Part 6— Leave and Public Holidays,28,28.6,e
Part 6— Leave and Public Holidays,28,28.6,f
Part 6— Leave and Public Holidays,28,28.6,g
Part 6— Leave and Public Holidays,28,28.6,h
Part 6— Leave and Public Holidays,28,28.6,i
Part 6— Leave and Public Holidays,28,28.7,a
Part 6— Leave and Public Holidays,28,28.7,b
Part 6— Leave and Public Holidays,28,28.7,c
Part 6— Leave and Public Holidays,28,28.7,d
Part 6— Leave and Public Holidays,28,28.8,a
Part 6— Leave and Public Holidays,28,28.8,b
Part 6— Leave and Public Holidays,28,28.8,c
Part 6— Leave and Public Holidays,28,28.8,d
Part 6— Leave and Public Holidays,28,28.9,a
Part 6— Leave and Public Holidays,28,28.9,b
Part 6— Leave and Public Holidays,28,28.9,c
Part 6— Leave and Public Holidays,28,28.9,d
Part 6— Leave and Public Holidays,28,28.9,e
Part 6— Leave and Public Holidays,29,29.1,
Part 6— Leave and Public Holidays,29,29.2,a
Part 6— Leave and Public Holidays,29,29.2,b
Part 6— Leave and Public Holidays,29,29.2,c
Part 6— Leave and Public Holidays,30,,
Part 6— Leave and Public Holidays,30A,,
Part 6— Leave and Public Holidays,31,,
Part 6— Leave and Public Holidays,32,,
Part 6— Leave and Public Holidays,33,a,
Part 6— Leave and Public Holidays,33,b,

resources/Templates/overtime_example.md

## Trigger Summary

- 38 Hours per week, which can be averaged over 1,2,3 or 4 weeks (22.1)
- Up to 20 days worked in a 28 day work cycle or (22.1a)
- Up to 19 days worked, with one day as ADO in a 28 day work cycle (22.1b)
- Eight hours on a day shift or 10 hours on a night shift.  (22.1c)
- For Day workers only, hours worked between 6AM to 6PM Monday to Friday (22.2a)
- For Shiftworkers, Ordinary hours may be worked outside 6AM to 6PM Monday to Friday (22.2b)
- Hours which are displayed on a roster (22.6a)

### Overtime Rules:

- Overtime is payable where an employee is required to be on duty during a meal break, until the meal break is taken  (24.1b)
- An employee recalled to work for overtime, will be entitled to receive a minimum of four hours worked ( 25.1e)
- For full time employees, any hours worked during a sleepover will be paid at overtime rates (22.9gi)

## When does overtime occur?

- For all employees, Any hours worked in excess of 76 hours in a pay period (22.1 - assuming that employees work a standard 14 day work week)
- For all employees, any days worked in excess of 20 days in a 28 day work cycle (22.1a), or where in excess of 19 hours in a 28 day work cycle are worked, with 1 day being an ADO (22.1b)
- For all permanent employees, working a day shift, any hours worked in excess of 8 on a day (22.1c)
- For all permanent employees, working a night shift, any hours worked in excess of 10 hours in a day (22.1c)
- For any casual employees, any hours in excess of 10 in a day (25.1.c)
- For day workers (not shift workers), any hours worked outside 6AM to 6PM, or on the weekend (22.2)
- For permanent (Full Time & Part Time) employees, hours work outside the specified roster (22.6a)
- For all employees, any hours worked beyond 5 hours, where employees are unable to take their break due to having to work (24.1b)
- For all employees, any hours (with a mininum of four) where the employee is recalled to work (25.1e)

- For Full Time employees, a minimum of four hours (22.7a)
- For Part Time and casual employees, a minimum of two hours (22.7b)

## Additional Consequences

- Any Full Time or Part time employees who works overtime without 10 consecutive hours break will be paid 200% until they have had a 10 hour break (25.1(d) )
- Any employee who works beyond one hour or their shift, or works one hour overtime will be supplied with a meal allowance of $16.62, and an additional $14.98 where the overtime exceeds for hours (15.4).  THis is not applicable where the employee is supplied with a meal, or could return home for a meal
- Employees may elect to take   Time off instead of payment for overtime (25.2)

### Additional Considerations:

Part time employees may agree not to receive overtime for working outside the specified roster time (25.1(b)iii)